{
  "ruleKey": "urn:arrowhr:rule:leave:conflict:overlap:v1",
  "domain": "leave",
  "ruleSet": "conflict",
  "name": "overlap",
  "description": "Same anchor as its pair, overlapping filter, no tie-break priority",
  "version": "1.0.0",
  "changeType": "MAJOR",
  "status": "active",
  "tenant": "RWB",
  "anchor": {"nodeId": "D003"},
  "attributeFilters": [
      {
        "attribute": "workerCategory",
        "op": "equals",
        "value": "PERMANENT"
      }
  ],
  "tieBreakPriority": 20,
  "effective": {
    "validFrom": "2026-01-01T00:00:00Z"
  },
  "declaredInputs": [
    "requestedDays"
  ],
  "declaredOutputs": [
    "allowed",
    "reasonCode"
  ],
  "decisionType": "leave-validation",
  "logic": {
    "hitPolicy": "first",
    "rows": [
      {
        "id": "decide",
        "when": {},
        "then": {
          "allowed": false,
          "reasonCode": "PERMANENT_CATEGORY_REFUSES"
        }
      }
    ]
  },
  "guards": [],
  "engineRef": {
    "engine": "decisiontable"
  },
  "metadata": {
    "owner": "Finance HR",
    "createdBy": "rule-service",
    "createdAt": "2026-01-01T00:00:00Z",
    "changeNote": "RT07: equally specific and equally ranked, so resolution must fail closed"
  }
}
