{
  "ruleKey": "urn:arrowhr:rule:leave:conflict:overlap-priority:v1",
  "domain": "leave",
  "ruleSet": "conflict",
  "name": "overlap-priority",
  "description": "The RT07 pair with an explicit tie-break priority",
  "version": "1.0.0",
  "changeType": "MAJOR",
  "status": "active",
  "tenant": "RWB",
  "anchor": {"nodeId": "D003"},
  "attributeFilters": [
      {
        "attribute": "employeeGroup",
        "op": "equals",
        "value": "Finance"
      }
  ],
  "tieBreakPriority": 10,
  "effective": {
    "validFrom": "2026-01-01T00:00:00Z"
  },
  "declaredInputs": [
    "requestedDays"
  ],
  "declaredOutputs": [
    "allowed",
    "reasonCode"
  ],
  "decisionType": "leave-validation",
  "logic": {
    "hitPolicy": "first",
    "rows": [
      {
        "id": "decide",
        "when": {},
        "then": {
          "allowed": true,
          "reasonCode": "FINANCE_GROUP_ALLOWS"
        }
      }
    ]
  },
  "guards": [],
  "engineRef": {
    "engine": "decisiontable"
  },
  "metadata": {
    "owner": "Finance HR",
    "createdBy": "rule-service",
    "createdAt": "2026-01-01T00:00:00Z",
    "changeNote": "RT12: the lower number wins"
  }
}
