{
  "ruleKey": "urn:arrowhr:rule:leave:eligibility:min-service:v1",
  "domain": "leave",
  "ruleSet": "eligibility",
  "name": "min-service",
  "description": "Minimum service requirement for leave eligibility",
  "version": "1.0.0",
  "changeType": "MAJOR",
  "status": "active",
  "tenant": "RWB",
  "anchor": {"nodeId": "G001"},
  "effective": {"validFrom": "2026-01-01T00:00:00Z"},
  "declaredInputs": ["serviceMonths"],
  "declaredOutputs": ["eligible", "reasonCode"],
  "decisionType": "leave-eligibility",
  "logic": {
    "hitPolicy": "first",
    "rows": [
      {
        "id": "eligible",
        "when": {"serviceMonths": ">= 6"},
        "then": {"eligible": true, "reasonCode": "ELIGIBLE"}
      },
      {
        "id": "insufficient-service",
        "when": {},
        "then": {"eligible": false, "reasonCode": "MIN_SERVICE_NOT_MET"}
      }
    ]
  },
  "guards": [],
  "engineRef": {"engine": "decisiontable"},
  "metadata": {
    "owner": "People Operations",
    "createdBy": "rule-service",
    "createdAt": "2026-01-01T00:00:00Z"
  }
}

